### ISSUE TITLE
Cache: redis cache 会复用已经断开的连接

### ISSUE THREAD

**Issue by lyfunny** [astaxie/beego#3201]
Please answer these questions before submitting your issue. Thanks!

1. What version of Go and beego are you using (`bee version`)?

├── Beego     : 1.9.2
├── GoVersion : go1.10.2
├── GOOS      : linux
├── GOARCH    : amd64
├── NumCPU    : 4
├── GOPATH    : /mnt/e/soulsocial/gowork
├── GOROOT    : /usr/local/go
├── Compiler  : gc
└── Date      : Wednesday, 13 Jun 2018

2. What operating system and processor architecture are you using (`go env`)?
GOARCH="amd64"
GOBIN="//usr/local/go/bin"
GOEXE=""
GOHOSTARCH="amd64"
GOHOSTOS="linux"
GOOS="linux"
GOPATH="/home/user/soulsocial/gowork"
GORACE=""
GOROOT="/usr/local/go"
GOTOOLDIR="/usr/local/go/pkg/tool/linux_amd64"
GCCGO="gccgo"
CC="gcc"
GOGCCFLAGS="-fPIC -m64 -pthread -fmessage-length=0 -fdebug-prefix-map=/tmp/go-build381897661=/tmp/go-build -gno-record-gcc-switches"
CXX="g++"
CGO_ENABLED="1"
PKG_CONFIG="pkg-config"
CGO_CFLAGS="-g -O2"
CGO_CPPFLAGS=""
CGO_CXXFLAGS="-g -O2"
CGO_FFLAGS="-g -O2"
CGO_LDFLAGS="-g -O2"

3. What did you do?
If possible, provide a recipe for reproducing the error.
A complete runnable program is good.

使用redis cache,redis-server 已经把不活动连接关了(redis-server 会自动关闭空闲连接)，但是beego这边感知不到，下次使用的时候会取到这条已经关闭的连接，然后发生err=EOF的错误，这次请求就失败了，下个请求才会重新开新连接
4. What did you expect to see?
希望beego能主动关闭以断开的连接，自动处理这种需要重连的情况，不要使业务失败。
```go
rc.p = &redis.Pool{
		MaxIdle:     3,
		IdleTimeout: 180 * time.Second,
		Dial:        dialFunc,
		TestOnBorrow: func(c redis.Conn, t time.Time) error {
			_, err := c.Do("PING")
			return err
		},
	}
```
目前我是在给连接池加了一个去连接测试的函数，但是这样每次使用都会多一次PING调用，希望能有更加高效的处理方法；如果减小IdleTimeout也是一种办法，那么可以提供配置参数？
5. What did you see instead?

**Comment by lybest** [comment]
14:11:59.250127 IP xiu94.6379 > bogon.38150: Flags [P.], seq 18:23, ack 140, win 57, options [nop,nop,TS val 1048986354 ecr 2856842346], length 5
14:11:59.290519 IP bogon.38150 > xiu94.6379: Flags [.], ack 23, win 229, options [nop,nop,TS val 2856842387 ecr 1048986354], length 0
14:13:00.142156 IP xiu94.6379 > bogon.38150: Flags [F.], seq 23, ack 140, win 57, options [nop,nop,TS val 1049047246 ecr 2856842387], length 0
14:13:00.182422 IP bogon.38150 > xiu94.6379: Flags [.], ack 24, win 229, options [nop,nop,TS val 2856903279 ecr 1049047246], length 0
14:13:57.855239 IP bogon.38150 > xiu94.6379: Flags [P.], seq 140:154, ack 24, win 229, options [nop,nop,TS val 2856960951 ecr 1049047246], length 14
14:13:57.855276 IP xiu94.6379 > bogon.38150: Flags [R], seq 1922685194, win 0, length 0
14:13:57.855291 IP bogon.38150 > xiu94.6379: Flags [F.], seq 154, ack 24, win 229, options [nop,nop,TS val 2856960951 ecr 1049047246], length 0
14:13:57.855462 IP xiu94.6379 > bogon.38150: Flags [R], seq 1922685194, win 0, length 0
14:13:57.855871 IP bogon.38548 > xiu94.6379: Flags [S], seq 97579474, win 29200, options [mss 1460,sackOK,TS val 2856960952 ecr
0,nop,wscale 7], length 0
14:13:57.855923 IP xiu94.6379 > bogon.38548: Flags [S.], seq 556667693, ack 97579475, win 14480, options [mss 1460,sackOK,TS val 1049104960 ecr 2856960952,nop,wscale 8], length 0
14:13:57.856455 IP bogon.38548 > xiu94.6379: Flags [.], ack 1, win 229, options [nop,nop,TS val 2856960952 ecr 1049104960], length 0
14:13:57.856620 IP bogon.38548 > xiu94.6379: Flags [P.], seq 1:24, ack 1, win 229, options [nop,nop,TS val 2856960953 ecr 1049104960], length 23
14:13:57.856635 IP xiu94.6379 > bogon.38548: Flags [.], ack 24, win 57, options [nop,nop,TS val 1049104961 ecr 2856960953], length 0
14:13:57.856734 IP xiu94.6379 > bogon.38548: Flags [P.], seq 1:6, ack 24, win 57, options [nop,nop,TS val 1049104961 ecr 2856960953], length 5
14:13:57.857177 IP bogon.38548 > xiu94.6379: Flags [.], ack 6, win 229, options [nop,nop,TS val 2856960953 ecr 1049104961], length 0
14:13:57.857345 IP bogon.38548 > xiu94.6379: Flags [P.], seq 24:75, ack 6, win 229, options [nop,nop,TS val 2856960953 ecr 1049104961], length 51
14:13:57.857959 IP xiu94.6379 > bogon.38548: Flags [P.], seq 6:11, ack 75, win 57, options [nop,nop,TS val 1049104962 ecr 2856960953], length 5
14:13:57.898557 IP bogon.38548 > xiu94.6379: Flags [.], ack 11, win 229, options [nop,nop,TS val 2856960995 ecr 1049104962], length 0

**Comment by jianzhiyao** [comment]
For now,default idle timeout of redis client is **180** seconds, you can run command ``config set timeout 360`` in redis server to fix it.
After https://github.com/astaxie/beego/pull/4033 merged, your can configure timeout when ``NewCache``
```go
bm, err := cache.NewCache("redis", `{"key":"collectionName","conn":":6039","dbNum":"0","password":"thePassWord","timeout":"180"}`)
```
